query_date,title,content,url,published_date
"January 3, 2009",Bitcoin Will Create a New Economic Elite in 2020 - Cointelegraph,"May 22, 2020 · On Jan. 3, 2009, when the Genesis Block​ of Bitcoin was mined, the mysterious creator, Satoshi Nakamoto, left a message in the block's raw",https://cointelegraph.com/news/bitcoin-will-create-a-new-economic-elite-in-2020,
"January 3, 2009",A Brief History of Bitcoin: 10 Years of Highs and Lows - Cointelegraph,"Oct 31, 2018 · On Jan. 3, 2009, Nakamoto successfully created the Genesis Block, the founding block of the Bitcoin blockchain. The Genesis block was hardcoded",https://cointelegraph.com/news/a-brief-history-of-bitcoin-10-years-of-highs-and-lows,
"January 3, 2009",Genesis Block - Cointelegraph Bitcoin & Ethereum Blockchain News,"Mar 23, 2024 · The Bitcoin genesis block was mined on Jan. 3, 2009, and is famously known as block 0. It was created by Satoshi Nakamoto as a way to launch the",https://cointelegraph.com/explained/what-is-the-genesis-block-explained,
"January 3, 2009",10 Years Ago Bitcoin's Genesis Block Changed the Course of History,"Jan 3, 2019 · Two months later, on Jan. 3, 2009, the network officially launched when Nakamoto mined block 0, bringing the Bitcoin blockchain into life.",https://news.bitcoin.com/10-years-ago-bitcoins-genesis-block-changed-the-course-of-history/,
"January 3, 2009",Crypto community speculates about Bitcoin transfer to Satoshi's ...,"Jan 22, 2024 · On Jan. 3, 2009, pseudonymous Bitcoin creator Satoshi Nakamoto mined the genesis block — the Bitcoin network's first-ever block. The genesis ...Missing:  world | Show results with:world",https://cointelegraph.com/news/crypto-community-bitcoin-transfer-satoshi-genesis-block,
